Recipe_ID,Recipe_Name,Title,Video_URL,Views
1,sloppy-joes,How to Make Sloppy Joes - Food Wishes,https://www.youtube.com/watch?v=UzUqoLe4At0&pp=ygUXaG93IHRvIG1ha2Ugc2xvcHB5IGpvZXM%3D,1.7M views
1,sloppy-joes,The Best Sloppy Joe Recipe by Delilah | How to Make Homemade Sloppy Joes The Simple Way,https://www.youtube.com/watch?v=7Dbwd_uX2x8&pp=ygUXaG93IHRvIG1ha2Ugc2xvcHB5IGpvZXM%3D,574K views
1,sloppy-joes,Grown Up Sloppy Joes,https://www.youtube.com/watch?v=3kjmBf4sWq4&pp=ygUXaG93IHRvIG1ha2Ugc2xvcHB5IGpvZXM%3D,1.3M views
2,buffalo-chicken,How To Make The Crispiest Baked Buffalo Chicken Wings | Delish,https://www.youtube.com/watch?v=ze39mtufeNE&pp=ygUbaG93IHRvIG1ha2UgYnVmZmFsbyBjaGlja2Vu,3.4M views
2,buffalo-chicken,The Best Buffalo Wings You'll Ever Make (Restaurant-Quality) | Epicurious 101,https://www.youtube.com/watch?v=yctF82YBG3Q&pp=ygUbaG93IHRvIG1ha2UgYnVmZmFsbyBjaGlja2Vu,2M views
2,buffalo-chicken,How to make Buffalo Chicken Bites Recipe,https://www.youtube.com/watch?v=PQQ976n7pgs&pp=ygUbaG93IHRvIG1ha2UgYnVmZmFsbyBjaGlja2Vu,77K views
3,triple-cheese-pepperoni-jalapeno-pizza,Domino's guy makes 3 Pizzas in 39 Seconds | Sarasota Herald-Tribune,https://www.youtube.com/watch?v=Vu9cWMQ9sWg&pp=ygUyaG93IHRvIG1ha2UgdHJpcGxlIGNoZWVzZSBwZXBwZXJvbmkgamFsYXBlbm8gcGl6emE%3D,24M views
4,smash-burger-pancakes,Smashburger Founder Tom Ryan Teaches Us How to Make A Smashburger,https://www.youtube.com/watch?v=kBHZBTXDBW4&pp=ygUhaG93IHRvIG1ha2Ugc21hc2ggYnVyZ2VyIHBhbmNha2Vz,6M views
5,snickerdoodles,Easy Snickerdoodle Cookies Recipe,https://www.youtube.com/watch?v=xrk7Z-stp60&pp=ygUaaG93IHRvIG1ha2Ugc25pY2tlcmRvb2RsZXM%3D,290K views
5,snickerdoodles,How to Make Perfect Snickerdoodle Cookies at Home,https://www.youtube.com/watch?v=sNJN7a_yghY&pp=ygUaaG93IHRvIG1ha2Ugc25pY2tlcmRvb2RsZXM%3D,232K views
5,snickerdoodles,The Best Soft & Chewy Snickerdoodle Cookies,https://www.youtube.com/watch?v=nklRiQXkY9o&pp=ygUaaG93IHRvIG1ha2Ugc25pY2tlcmRvb2RsZXM%3D,1.8M views
6,corndogs,How To Make CORN DOGS | Honey Corn Dog Recipe,https://www.youtube.com/watch?v=TKlI82_qhcU&pp=ygUUaG93IHRvIG1ha2UgY29ybmRvZ3M%3D,1.3M views
6,corndogs,How to Make Corn Dogs | Easy Homemade Corn Dog Recipe,https://www.youtube.com/watch?v=kXYo1vZKx5c&pp=ygUUaG93IHRvIG1ha2UgY29ybmRvZ3M%3D,2.2M views
6,corndogs,corn dog recipe - Yummy cooking crispy hot dog,https://www.youtube.com/watch?v=VUg4HrtlZm4&pp=ygUUaG93IHRvIG1ha2UgY29ybmRvZ3M%3D,4.3M views
7,tahini-mississippi-mud-pie,How to Make the Ultimate Mississippi Mud Pie,https://www.youtube.com/watch?v=AlrbvBqKmZw&pp=ygUmaG93IHRvIG1ha2UgdGFoaW5pIG1pc3Npc3NpcHBpIG11ZCBwaWU%3D,116K views
7,tahini-mississippi-mud-pie,Idiot Proof Mississippi Mud Pie,https://www.youtube.com/watch?v=SUsQV3GOSVc&pp=ygUmaG93IHRvIG1ha2UgdGFoaW5pIG1pc3Npc3NpcHBpIG11ZCBwaWU%3D,4.9K views
7,tahini-mississippi-mud-pie,How To Make Mississippi Mud Pie | Samantha Seneviratne | NYT Cooking,https://www.youtube.com/watch?v=E2S12kynL3w&pp=ygUmaG93IHRvIG1ha2UgdGFoaW5pIG1pc3Npc3NpcHBpIG11ZCBwaWU%3D,156K views
8,texas-bbq-medley,Texas BBQ medley : Best Recipe,https://www.youtube.com/watch?v=7DoPXgbvqVs&pp=ygUcaG93IHRvIG1ha2UgdGV4YXMgYmJxIG1lZGxleQ%3D%3D,59 views
8,texas-bbq-medley,Texas BBQ Medley: The Ultimate Smoky Chicken Guide..,https://www.youtube.com/watch?v=Db00QbbPwdY&pp=ygUcaG93IHRvIG1ha2UgdGV4YXMgYmJxIG1lZGxleQ%3D%3D,12 views
8,texas-bbq-medley,The Best Texas Pit Masters Teach Me How To Master Texas BBQ At Home,https://www.youtube.com/watch?v=IwkjTNGDTYE&pp=ygUcaG93IHRvIG1ha2UgdGV4YXMgYmJxIG1lZGxleQ%3D%3D,1.2M views
9,bbq-chicken-platter,BBQ Chicken Platter| How to make Quick Chicken Party Platter at Home | बारबेक्यू चिकन,https://www.youtube.com/watch?v=v-RCBScIYTU&pp=ygUfaG93IHRvIG1ha2UgYmJxIGNoaWNrZW4gcGxhdHRlcg%3D%3D,2.1M views
9,bbq-chicken-platter,BBQ Chicken Platter| How to make Quick Chicken Party Platter at Home | Dawat special Chicken Platter,https://www.youtube.com/watch?v=n95cvRZmhA0&pp=ygUfaG93IHRvIG1ha2UgYmJxIGNoaWNrZW4gcGxhdHRlcg%3D%3D,12K views
9,bbq-chicken-platter,Party/Dawat Menu - BBQ Platter without coals/grill at home,https://www.youtube.com/watch?v=BH-di2No5IA&pp=ygUfaG93IHRvIG1ha2UgYmJxIGNoaWNrZW4gcGxhdHRlcg%3D%3D,1.7M views
10,truffled-mac-n-cheese,Truffle Mac and Cheese | How To Make Recipe,https://www.youtube.com/watch?v=TTh9gXLyyrM&pp=ygUhaG93IHRvIG1ha2UgdHJ1ZmZsZWQgbWFjIG4gY2hlZXNl,17K views
10,truffled-mac-n-cheese,How to make Truffle Mac & Cheese with Bacon,https://www.youtube.com/watch?v=6wGWA48q7dE&pp=ygUhaG93IHRvIG1ha2UgdHJ1ZmZsZWQgbWFjIG4gY2hlZXNl,1.5K views
10,truffled-mac-n-cheese,Ina Garten's Truffled Mac And Cheese | Barefoot Contessa | Food Network,https://www.youtube.com/watch?v=lDAwpRX4yjY&pp=ygUhaG93IHRvIG1ha2UgdHJ1ZmZsZWQgbWFjIG4gY2hlZXNl,88K views
11,smores-dip,I Can’t Stop Making This S’mores Dip Recipe! | How To Make S’mores Dip,https://www.youtube.com/watch?v=xgcVG5a_o9s&pp=ygUWaG93IHRvIG1ha2Ugc21vcmVzIGRpcA%3D%3D,13K views
11,smores-dip,S'mores Cookies in the winter! New recipe from Pinterest!,https://www.youtube.com/watch?v=of9YWqLt6sQ&pp=ygUWaG93IHRvIG1ha2Ugc21vcmVzIGRpcA%3D%3D,209 views
12,hot-gumbo-dip,Warm Gumbo Dip | Southern Living,https://www.youtube.com/watch?v=WKs0ptrL3-I&pp=ygUZaG93IHRvIG1ha2UgaG90IGd1bWJvIGRpcA%3D%3D,2K views
12,hot-gumbo-dip,Easy gumbo recipe - authentic gumbo recipe,https://www.youtube.com/watch?v=lXm-P2PSv-U&pp=ygUZaG93IHRvIG1ha2UgaG90IGd1bWJvIGRpcA%3D%3D,543K views
12,hot-gumbo-dip,Make Louisiana Shrimp Dip in Minutes: An Easy and Delicious Recipe!,https://www.youtube.com/watch?v=ri1ecwYg1IU&pp=ygUZaG93IHRvIG1ha2UgaG90IGd1bWJvIGRpcA%3D%3D,109K views
13,fully-loaded-cajun-chicken-burgers,How to make Really Tasty Cajun Chicken Burgers,https://www.youtube.com/watch?v=LL9TO9wSnV8&pp=ygUuaG93IHRvIG1ha2UgZnVsbHkgbG9hZGVkIGNhanVuIGNoaWNrZW4gYnVyZ2Vycw%3D%3D,229 views
13,fully-loaded-cajun-chicken-burgers,SPICY CAJUN CHICKEN BURGERS,https://www.youtube.com/watch?v=YSYGusxgq5c&pp=ygUuaG93IHRvIG1ha2UgZnVsbHkgbG9hZGVkIGNhanVuIGNoaWNrZW4gYnVyZ2Vycw%3D%3D,77 views
13,fully-loaded-cajun-chicken-burgers,Grilled Cajun Chicken Sandwich | Best Cajun Chicken Burger | Cajun Chicken Mayo Sandwich,https://www.youtube.com/watch?v=OEkHkT5pm5I&pp=ygUuaG93IHRvIG1ha2UgZnVsbHkgbG9hZGVkIGNhanVuIGNoaWNrZW4gYnVyZ2Vycw%3D%3D,6.5K views
14,tomato-avocado-corn-salad-migas-buttermilk-dressing,Avocado Corn Salad Recipe With Easy Salad Dressing,https://www.youtube.com/watch?v=Nr3eqepQVPc&pp=ygU_aG93IHRvIG1ha2UgdG9tYXRvIGF2b2NhZG8gY29ybiBzYWxhZCBtaWdhcyBidXR0ZXJtaWxrIGRyZXNzaW5n,1.1M views
14,tomato-avocado-corn-salad-migas-buttermilk-dressing,Corn Salad with Avocado,https://www.youtube.com/watch?v=m8luST6lB3g&pp=ygU_aG93IHRvIG1ha2UgdG9tYXRvIGF2b2NhZG8gY29ybiBzYWxhZCBtaWdhcyBidXR0ZXJtaWxrIGRyZXNzaW5n,29K views
14,tomato-avocado-corn-salad-migas-buttermilk-dressing,Avocado Corn Salad _with simple Salad Dressing,https://www.youtube.com/watch?v=BJBPFl2J31U&pp=ygU_aG93IHRvIG1ha2UgdG9tYXRvIGF2b2NhZG8gY29ybiBzYWxhZCBtaWdhcyBidXR0ZXJtaWxrIGRyZXNzaW5n,2K views
16,sticky-bourbon-bbq-wings-blue-cheese-dip,Spicy Bourbon BBQ Hot Wings w/ Blue Cheese Dip,https://www.youtube.com/watch?v=5xuGMXYvX-o&pp=ygU0aG93IHRvIG1ha2Ugc3RpY2t5IGJvdXJib24gYmJxIHdpbmdzIGJsdWUgY2hlZXNlIGRpcA%3D%3D,32K views
16,sticky-bourbon-bbq-wings-blue-cheese-dip,Buffalo Chicken Wing Blue Cheese Dip Recipe,https://www.youtube.com/watch?v=kFHWFAMzvQ4&pp=ygU0aG93IHRvIG1ha2Ugc3RpY2t5IGJvdXJib24gYmJxIHdpbmdzIGJsdWUgY2hlZXNlIGRpcA%3D%3D,20K views
16,sticky-bourbon-bbq-wings-blue-cheese-dip,Crispy BBQ Buffalo Wings With Blue Cheese Dipping Sauce,https://www.youtube.com/watch?v=VbGo_ik09uc&pp=ygU0aG93IHRvIG1ha2Ugc3RpY2t5IGJvdXJib24gYmJxIHdpbmdzIGJsdWUgY2hlZXNlIGRpcA%3D%3D,2.1K views
17,southern-fried-prawns,How To Make The BEST Fried Shrimp| Better Than Popeyes| Crispy Fried Shrimp,https://www.youtube.com/watch?v=NdaB4Ilhw18&pp=ygUhaG93IHRvIG1ha2Ugc291dGhlcm4gZnJpZWQgcHJhd25z,2M views
17,southern-fried-prawns,How to make Southern Fried Shrimp recipe | Best Fried Shrimp,https://www.youtube.com/watch?v=LxDlRTctwos&pp=ygUhaG93IHRvIG1ha2Ugc291dGhlcm4gZnJpZWQgcHJhd25z,285K views
17,southern-fried-prawns,Crispy Fried Shrimp - Southern Restaurant Secrets for Home Cooking - PoorMansGourmet,https://www.youtube.com/watch?v=6wiXYIN8oGw&pp=ygUhaG93IHRvIG1ha2Ugc291dGhlcm4gZnJpZWQgcHJhd25z,2.3M views
18,spicy-pies-sweet-potato-mash,COOKING SPICY PIES with MASHED SWEET POTATO,https://www.youtube.com/watch?v=LHu9rKqKMYQ&pp=ygUoaG93IHRvIG1ha2Ugc3BpY3kgcGllcyBzd2VldCBwb3RhdG8gbWFzaA%3D%3D,505 views
18,spicy-pies-sweet-potato-mash,Spiced Pork Chop with Sweet Potato Mash | Gordon Ramsay,https://www.youtube.com/watch?v=cM_qi9KDocg&pp=ygUoaG93IHRvIG1ha2Ugc3BpY3kgcGllcyBzd2VldCBwb3RhdG8gbWFzaA%3D%3D,4.1M views
18,spicy-pies-sweet-potato-mash,How to Make a Sweet Potato Pie | Sweet Potato Pie | Thanksgiving Recipe,https://www.youtube.com/watch?v=DrSODAuWZxo&pp=ygUoaG93IHRvIG1ha2Ugc3BpY3kgcGllcyBzd2VldCBwb3RhdG8gbWFzaA%3D%3D,977K views
19,cheesesteak-hotdogs,Philly Cheesesteak Hot Dog Recipe | Chef Tom X All Things BBQ,https://www.youtube.com/watch?v=M4LTd_5BOZw&pp=ygUfaG93IHRvIG1ha2UgY2hlZXNlc3RlYWsgaG90ZG9ncw%3D%3D,47K views
19,cheesesteak-hotdogs,How to create the perfect Philly cheesesteak,https://www.youtube.com/watch?v=05Z1VjyTQck&pp=ygUfaG93IHRvIG1ha2UgY2hlZXNlc3RlYWsgaG90ZG9ncw%3D%3D,2.9M views
19,cheesesteak-hotdogs,Philly Cheese Hot Dog Recipe - Greg's Kitchen,https://www.youtube.com/watch?v=j6hIJxI-zbY&pp=ygUfaG93IHRvIG1ha2UgY2hlZXNlc3RlYWsgaG90ZG9ncw%3D%3D,52K views
20,creamed-corn,How to Make Martha Stewart's Creamed Corn | Martha's Cooking School | Martha Stewart,https://www.youtube.com/watch?v=sFwhUv2LDjc&pp=ygUYaG93IHRvIG1ha2UgY3JlYW1lZCBjb3Ju,108K views
20,creamed-corn,How to Make Creamed Corn | Get Cookin' | Allrecipes,https://www.youtube.com/watch?v=xf_4Xuy2c00&pp=ygUYaG93IHRvIG1ha2UgY3JlYW1lZCBjb3Ju,67K views
20,creamed-corn,How Granny Makes Cream Style Corn,https://www.youtube.com/watch?v=GSrfbEnojhU&pp=ygUYaG93IHRvIG1ha2UgY3JlYW1lZCBjb3Ju,65K views
21,american-pancakes,Classic American Pancakes,https://www.youtube.com/watch?v=RTExkuPgxlI&pp=ygUdaG93IHRvIG1ha2UgYW1lcmljYW4gcGFuY2FrZXM%3D,2.4M views
21,american-pancakes,How to Make American Pancakes - Easy Homemade Pancake Recipe from Scratch,https://www.youtube.com/watch?v=wiWB46xiIwU&pp=ygUdaG93IHRvIG1ha2UgYW1lcmljYW4gcGFuY2FrZXM%3D,4.7M views
21,american-pancakes,How to Make Pancakes at Home | Easy Pancake Recipe,https://www.youtube.com/watch?v=NCMKedZvnyI&pp=ygUdaG93IHRvIG1ha2UgYW1lcmljYW4gcGFuY2FrZXM%3D,22M views
22,baby-back-ribs-carolina-baste,Baby Back Ribs W/Carolina Red Vinegar Sauce - Smoking Ribs Quarantine Cooking!,https://www.youtube.com/watch?v=gbVJQBbjGP0&pp=ygUpaG93IHRvIG1ha2UgYmFieSBiYWNrIHJpYnMgY2Fyb2xpbmEgYmFzdGU%3D,8.7K views
22,baby-back-ribs-carolina-baste,Texas Carolina BBQ Ribs! | Chuds BBQ,https://www.youtube.com/watch?v=salkS_AZZkM&pp=ygUpaG93IHRvIG1ha2UgYmFieSBiYWNrIHJpYnMgY2Fyb2xpbmEgYmFzdGU%3D,191K views
22,baby-back-ribs-carolina-baste,The WINNINGEST MAN IN BBQ Shows Us How to Grill Ribs | Myron Mixon | The Daily Meal,https://www.youtube.com/watch?v=vEJrAdL8_cI&t=259s&pp=ygUpaG93IHRvIG1ha2UgYmFieSBiYWNrIHJpYnMgY2Fyb2xpbmEgYmFzdGU%3D,1.6M views
23,choc-chip-pecan-pie,Chocolate Pecan Pie Recipe - Pecan Pie with Semi-Sweet Chocolate Chips,https://www.youtube.com/watch?v=fDpoT0jvg4Y&pp=ygUfaG93IHRvIG1ha2UgY2hvYyBjaGlwIHBlY2FuIHBpZQ%3D%3D,234K views
23,choc-chip-pecan-pie,How to Make Chocolate Chip Pecan Pie,https://www.youtube.com/watch?v=RtFoqGd1iQg&pp=ygUfaG93IHRvIG1ha2UgY2hvYyBjaGlwIHBlY2FuIHBpZQ%3D%3D,889 views
23,choc-chip-pecan-pie,HOW TO MAKE CHOCOLATE CHIP PECAN PIE VERY EASY RECIPE,https://www.youtube.com/watch?v=z6XQeX3L98c&pp=ygUfaG93IHRvIG1ha2UgY2hvYyBjaGlwIHBlY2FuIHBpZQ%3D%3D,281 views
24,mini-pork-pies-piccalilli,"Mini Pork Pies, Very easy to make and delicious",https://www.youtube.com/watch?v=9qkkOr1hTaQ&pp=ygUlaG93IHRvIG1ha2UgbWluaSBwb3JrIHBpZXMgcGljY2FsaWxsaQ%3D%3D,321K views
24,mini-pork-pies-piccalilli,How to make Mini Pork Pies,https://www.youtube.com/watch?v=KuIgzW0rGPA&pp=ygUlaG93IHRvIG1ha2UgbWluaSBwb3JrIHBpZXMgcGljY2FsaWxsaQ%3D%3D,8K views
24,mini-pork-pies-piccalilli,Mini pork pies – short film with recipe / cooking ASMR,https://www.youtube.com/watch?v=pXYYIWMAWBI&pp=ygUlaG93IHRvIG1ha2UgbWluaSBwb3JrIHBpZXMgcGljY2FsaWxsaQ%3D%3D,1.1K views
25,herby-toad-hole,Toad in the hole - a British classic!,https://www.youtube.com/watch?v=zsIbAhUOV9k&pp=ygUbaG93IHRvIG1ha2UgaGVyYnkgdG9hZCBob2xl,528K views
25,herby-toad-hole,Toad In The Hole | Jamie Oliver,https://www.youtube.com/watch?v=k0HqhWezM3k&pp=ygUbaG93IHRvIG1ha2UgaGVyYnkgdG9hZCBob2xl,823K views
25,herby-toad-hole,Marco Pierre White recipe for Toad in the Hole,https://www.youtube.com/watch?v=2e8YBpDfTGM&pp=ygUbaG93IHRvIG1ha2UgaGVyYnkgdG9hZCBob2xl,754K views
26,crispy-topped-cumberland-pie,Crispy topped Cumberland pie Uk Dinner Recipe by cooking with fatima sana.,https://www.youtube.com/watch?v=VO1nOq0g364&pp=ygUoaG93IHRvIG1ha2UgY3Jpc3B5IHRvcHBlZCBjdW1iZXJsYW5kIHBpZQ%3D%3D,568 views
26,crispy-topped-cumberland-pie,Cumberland Pie Traditional BRITISH Dish,https://www.youtube.com/watch?v=v_9tUwzCBGU&pp=ygUoaG93IHRvIG1ha2UgY3Jpc3B5IHRvcHBlZCBjdW1iZXJsYW5kIHBpZQ%3D%3D,59K views
26,crispy-topped-cumberland-pie,Cumberland Pie,https://www.youtube.com/watch?v=Vv6mMf1nTZU&pp=ygUoaG93IHRvIG1ha2UgY3Jpc3B5IHRvcHBlZCBjdW1iZXJsYW5kIHBpZQ%3D%3D,2.8K views
27,sticky-toffee-pudding-traybake,Sticky Toffee Pudding Traybake,https://www.youtube.com/watch?v=V66DV8jTqn4&pp=ygUqaG93IHRvIG1ha2Ugc3RpY2t5IHRvZmZlZSBwdWRkaW5nIHRyYXliYWtl,5.5K views
27,sticky-toffee-pudding-traybake,How to Make Individual Sticky Toffee Pudding Cakes,https://www.youtube.com/watch?v=lZpGUWygrlg&pp=ygUqaG93IHRvIG1ha2Ugc3RpY2t5IHRvZmZlZSBwdWRkaW5nIHRyYXliYWtl,102K views
27,sticky-toffee-pudding-traybake,Sticky Date Pudding (aka Sticky Toffee Pudding),https://www.youtube.com/watch?v=vIG37JV393Y&pp=ygUqaG93IHRvIG1ha2Ugc3RpY2t5IHRvZmZlZSBwdWRkaW5nIHRyYXliYWtl,496K views
28,great-british-breakfast-bap,Sausage & Egg Bap | Jamie Oliver,https://www.youtube.com/watch?v=gPFvenJDMnM&pp=ygUnaG93IHRvIG1ha2UgZ3JlYXQgYnJpdGlzaCBicmVha2Zhc3QgYmFw,147K views
28,great-british-breakfast-bap,A Not-So-English Breakfast,https://www.youtube.com/watch?v=wsu-jDcONxk&pp=ygUnaG93IHRvIG1ha2UgZ3JlYXQgYnJpdGlzaCBicmVha2Zhc3QgYmFw,4.5M views
28,great-british-breakfast-bap,How to Make Breakfast Like a Brit - Anglophenia Ep 32,https://www.youtube.com/watch?v=rmieAqTG1wI&pp=ygUnaG93IHRvIG1ha2UgZ3JlYXQgYnJpdGlzaCBicmVha2Zhc3QgYmFw,1.9M views
29,cherry-almond-tarts,Fool-Proof Cherry Almond Tart (Frangipane),https://www.youtube.com/watch?v=b1q1jGl2NWM&pp=ygUfaG93IHRvIG1ha2UgY2hlcnJ5IGFsbW9uZCB0YXJ0cw%3D%3D,1.6K views
29,cherry-almond-tarts,Make a Cherry Almond Tart From Scratch,https://www.youtube.com/watch?v=5NBN-WmWKTM&pp=ygUfaG93IHRvIG1ha2UgY2hlcnJ5IGFsbW9uZCB0YXJ0cw%3D%3D,407 views
29,cherry-almond-tarts,Cherry And Almond Cake | Easy Cherry And Almond Tart,https://www.youtube.com/watch?v=WCgVyslcKMU&pp=ygUfaG93IHRvIG1ha2UgY2hlcnJ5IGFsbW9uZCB0YXJ0cw%3D%3D,4.1K views
30,classic-summer-pudding,How To Make Classic Summer Pudding | Waitrose,https://www.youtube.com/watch?v=LnNXGtLTEaY&pp=ygUiaG93IHRvIG1ha2UgY2xhc3NpYyBzdW1tZXIgcHVkZGluZw%3D%3D,62K views
30,classic-summer-pudding,How to make summer pudding,https://www.youtube.com/watch?v=48XnvJAuYPk&pp=ygUiaG93IHRvIG1ha2UgY2xhc3NpYyBzdW1tZXIgcHVkZGluZw%3D%3D,531 views
30,classic-summer-pudding,How to make Summer Pudding - a classic British dessert recipe,https://www.youtube.com/watch?v=BwX09FLKVG8&pp=ygUiaG93IHRvIG1ha2UgY2xhc3NpYyBzdW1tZXIgcHVkZGluZw%3D%3D,120 views
31,roast-beef-caramelised-onion-gravy,A Gordon Ramsay recipe (ROAST BEEF WITH CARAMELISED ONION GRAVY),https://www.youtube.com/watch?v=tMVsN4cBUL4&pp=ygUuaG93IHRvIG1ha2Ugcm9hc3QgYmVlZiBjYXJhbWVsaXNlZCBvbmlvbiBncmF2eQ%3D%3D,322 views
31,roast-beef-caramelised-onion-gravy,How to Cook Perfect Roast Beef | Jamie Oliver,https://www.youtube.com/watch?v=rApdDLwp_gM&pp=ygUuaG93IHRvIG1ha2Ugcm9hc3QgYmVlZiBjYXJhbWVsaXNlZCBvbmlvbiBncmF2eQ%3D%3D,7.8M views
31,roast-beef-caramelised-onion-gravy,How to Caramelize Onions Like a Pro | Food Network,https://www.youtube.com/watch?v=v-bhA0GcoLM&pp=ygUuaG93IHRvIG1ha2Ugcm9hc3QgYmVlZiBjYXJhbWVsaXNlZCBvbmlvbiBncmF2eQ%3D%3D,4.2M views
32,roast-lamb-spring-herb-crumbs,How to Cook a Leg of Lamb | Jamie Oliver,https://www.youtube.com/watch?v=Szv5Yx7xdyM&pp=ygUpaG93IHRvIG1ha2Ugcm9hc3QgbGFtYiBzcHJpbmcgaGVyYiBjcnVtYnM%3D,1.9M views
32,roast-lamb-spring-herb-crumbs,"Garlic and Herb Roast Leg of Lamb, Slow Cooked",https://www.youtube.com/watch?v=f6079901PmU&pp=ygUpaG93IHRvIG1ha2Ugcm9hc3QgbGFtYiBzcHJpbmcgaGVyYiBjcnVtYnM%3D,1M views
32,roast-lamb-spring-herb-crumbs,"Garlic and Herb Roast Leg of Lamb, Slow Cooked",https://www.youtube.com/watch?v=IvBohGG3rEs&pp=ygUpaG93IHRvIG1ha2Ugcm9hc3QgbGFtYiBzcHJpbmcgaGVyYiBjcnVtYnM%3D,15K views
33,no-fail-yorkies,Making BBC Food's 'No-Fail' Yorkies (Yorkshire Puddings),https://www.youtube.com/watch?v=hIyxOqSY2mk&pp=ygUbaG93IHRvIG1ha2Ugbm8gZmFpbCB5b3JraWVz,1.3K views
33,no-fail-yorkies,How to Make Perfect Yorkshire Puddings,https://www.youtube.com/watch?v=FZD7tlm7I0E&pp=ygUbaG93IHRvIG1ha2Ugbm8gZmFpbCB5b3JraWVz,417K views
33,no-fail-yorkies,How To Make Yorkshire Puddings | Jamie Oliver,https://www.youtube.com/watch?v=nUvIJqhq0KQ&pp=ygUbaG93IHRvIG1ha2Ugbm8gZmFpbCB5b3JraWVz,6.4M views
34,st-clements-pie,Festive Vegan Canapé Recipe | St Clement's Mince Pies | Vitality UK,https://www.youtube.com/watch?v=ikVuRamSVpQ&pp=ygUbaG93IHRvIG1ha2Ugc3QgY2xlbWVudHMgcGll,212 views
34,st-clements-pie,Sensational St. Clements Cake and Lemon Love Puddings,https://www.youtube.com/watch?v=dGeDDIn83Eg&pp=ygUbaG93IHRvIG1ha2Ugc3QgY2xlbWVudHMgcGll,86 views
34,st-clements-pie,St Clement's Squares | Sundaebake,https://www.youtube.com/watch?v=hMbuECBlrso&pp=ygUbaG93IHRvIG1ha2Ugc3QgY2xlbWVudHMgcGll,371 views
35,beef-ale-parsnip-pudding,TRADITIONAL ENGLISH BEEFSTEAK SUET PUDDING,https://www.youtube.com/watch?v=uz5I6V7hWnE&pp=ygUkaG93IHRvIG1ha2UgYmVlZiBhbGUgcGFyc25pcCBwdWRkaW5n,8.9K views
35,beef-ale-parsnip-pudding,How to make Cunards signature Steak and Ale Pie (Full recipe in description),https://www.youtube.com/watch?v=cEmF9z8kUB0&pp=ygUkaG93IHRvIG1ha2UgYmVlZiBhbGUgcGFyc25pcCBwdWRkaW5n,328 views
35,beef-ale-parsnip-pudding,Steak & Kidney Pudding (The king of savoury puddings),https://www.youtube.com/watch?v=aa-UGitbDgw&pp=ygUkaG93IHRvIG1ha2UgYmVlZiBhbGUgcGFyc25pcCBwdWRkaW5n,189K views
36,fat-rascals,Yorkshire FAT RASCALS a delightful BRITISH treat,https://www.youtube.com/watch?v=L74YyOA-nLs&pp=ygUXaG93IHRvIG1ha2UgZmF0IHJhc2NhbHM%3D,100K views
36,fat-rascals,"How to make Fat Rascals - Scones from Betty's Tea Rooms, Yorkshire, UK.",https://www.youtube.com/watch?v=iwfSI7dsXQs&pp=ygUXaG93IHRvIG1ha2UgZmF0IHJhc2NhbHM%3D,10K views
36,fat-rascals,Yorkshire Fat Rascals Recipe (in grams & cups) A TASTE OF THE NORTH! | Turf Buns #britishrecipes,https://www.youtube.com/watch?v=JXspy2tM7jg&pp=ygUXaG93IHRvIG1ha2UgZmF0IHJhc2NhbHM%3D,5.2K views
37,scampi-tartare-sauce,Slimming World scampi and tartare sauce recipe - 1½ Syns per serving,https://www.youtube.com/watch?v=uq7pb8MhbrQ&pp=ygUgaG93IHRvIG1ha2Ugc2NhbXBpIHRhcnRhcmUgc2F1Y2U%3D,5.4K views
37,scampi-tartare-sauce,How to Make the Best Homemade Tartar Sauce,https://www.youtube.com/watch?v=kQhXXO_gC3k&pp=ygUgaG93IHRvIG1ha2Ugc2NhbXBpIHRhcnRhcmUgc2F1Y2U%3D,1M views
37,scampi-tartare-sauce,Homemade Tartar Sauce from Scratch | How to Make Tartar Sauce With Mayonnaise | Chef James,https://www.youtube.com/watch?v=ygjh6shM2-4&pp=ygUgaG93IHRvIG1ha2Ugc2NhbXBpIHRhcnRhcmUgc2F1Y2U%3D,102K views
38,easy-treacle-sponge,Easy homemade treacle sponge,https://www.youtube.com/watch?v=JnugdqyEXNs&pp=ygUfaG93IHRvIG1ha2UgZWFzeSB0cmVhY2xlIHNwb25nZQ%3D%3D,13K views
38,easy-treacle-sponge,Nigella's Speedy Steamed Syrup Sponge,https://www.youtube.com/watch?v=AxPj7AUdTh4&pp=ygUfaG93IHRvIG1ha2UgZWFzeSB0cmVhY2xlIHNwb25nZQ%3D%3D,42K views
38,easy-treacle-sponge,Speedy Sponge Pudding | Jamie Oliver,https://www.youtube.com/watch?v=p6zohXFn2Kw&pp=ygUfaG93IHRvIG1ha2UgZWFzeSB0cmVhY2xlIHNwb25nZQ%3D%3D,136K views
39,scotch-eggs,The Perfect Egg Recipe (Scotch Eggs 3 Ways),https://www.youtube.com/watch?v=Hs1ccQFnNZI&pp=ygUXaG93IHRvIG1ha2Ugc2NvdGNoIGVnZ3M%3D,1.8M views
39,scotch-eggs,Gordon Ramsay’s Scotch Eggs with a Twist,https://www.youtube.com/watch?v=k8SXf5V8aPM&pp=ygUXaG93IHRvIG1ha2Ugc2NvdGNoIGVnZ3M%3D,2.2M views
39,scotch-eggs,How to Make Scotch Eggs | Get Cookin' | Allrecipes,https://www.youtube.com/watch?v=TixmZ2NylzI&pp=ygUXaG93IHRvIG1ha2Ugc2NvdGNoIGVnZ3M%3D,113K views
40,rhubarb-pear-hazelnut-crumbles,Pear and Rhubarb Crumbles | GCBC14 Ep49,https://www.youtube.com/watch?v=OeoxSMXfQ1c&pp=ygUqaG93IHRvIG1ha2Ugcmh1YmFyYiBwZWFyIGhhemVsbnV0IGNydW1ibGVz,705 views
40,rhubarb-pear-hazelnut-crumbles,"Rhubarb, pear and ginger oat crumble - Neff Recipes | ao.com Recipes",https://www.youtube.com/watch?v=j2PhH0CG6GE&pp=ygUqaG93IHRvIG1ha2Ugcmh1YmFyYiBwZWFyIGhhemVsbnV0IGNydW1ibGVz,22K views
40,rhubarb-pear-hazelnut-crumbles,Pear and Rhubarb Crumble | Chef In My Kitchen,https://www.youtube.com/watch?v=BRJCuT1pLUk&t=5s&pp=ygUqaG93IHRvIG1ha2Ugcmh1YmFyYiBwZWFyIGhhemVsbnV0IGNydW1ibGVz,196 views
41,lemon-thyme-butter-basted-roast-chicken-gravy,"Roast Chicken with Thyme, Lemon and Gravy.flv",https://www.youtube.com/watch?v=_2kIO80tAfU&pp=ygU5aG93IHRvIG1ha2UgbGVtb24gdGh5bWUgYnV0dGVyIGJhc3RlZCByb2FzdCBjaGlja2VuIGdyYXZ5,3M views
41,lemon-thyme-butter-basted-roast-chicken-gravy,Thyme Lemon Roast Chicken with Gravy,https://www.youtube.com/watch?v=1TtY5-frh8w&t=1s&pp=ygU5aG93IHRvIG1ha2UgbGVtb24gdGh5bWUgYnV0dGVyIGJhc3RlZCByb2FzdCBjaGlja2VuIGdyYXZ5,319 views
41,lemon-thyme-butter-basted-roast-chicken-gravy,Salt-Roasted Chicken Recipe - Roast Chicken with Thyme Butter Sauce,https://www.youtube.com/watch?v=d4z_N0GjqCY&pp=ygU5aG93IHRvIG1ha2UgbGVtb24gdGh5bWUgYnV0dGVyIGJhc3RlZCByb2FzdCBjaGlja2VuIGdyYXZ5,1.2M views
42,marzipan-eccles-tarts,Marzipan Eccles tarts,https://www.youtube.com/watch?v=tjhilQB0FVs&pp=ygUhaG93IHRvIG1ha2UgbWFyemlwYW4gZWNjbGVzIHRhcnRz,108 views
42,marzipan-eccles-tarts,Co-op Food | Mincemeat & Marzipan Tart,https://www.youtube.com/watch?v=qLxXhfbI7uQ&pp=ygUhaG93IHRvIG1ha2UgbWFyemlwYW4gZWNjbGVzIHRhcnRz,2.8K views
42,marzipan-eccles-tarts,"How to Make ""Æbletærte:"" Apple Tart with Marzipan Filling!",https://www.youtube.com/watch?v=oIfzsXjvzSk&pp=ygUhaG93IHRvIG1ha2UgbWFyemlwYW4gZWNjbGVzIHRhcnRz,375 views
43,ultimate-makeover-steak-kidney-pie,English Steak & Kidney Pie,https://www.youtube.com/watch?v=siMY0ucFkk0&t=58s&pp=ygUuaG93IHRvIG1ha2UgdWx0aW1hdGUgbWFrZW92ZXIgc3RlYWsga2lkbmV5IHBpZQ%3D%3D,69K views
43,ultimate-makeover-steak-kidney-pie,Easy Steak and Kidney Pie recipe/ How to make Steak and Kidney Pie/ Steak and Kidney Pot pie,https://www.youtube.com/watch?v=qrUy9F8rOqs&pp=ygUuaG93IHRvIG1ha2UgdWx0aW1hdGUgbWFrZW92ZXIgc3RlYWsga2lkbmV5IHBpZQ%3D%3D,53K views
43,ultimate-makeover-steak-kidney-pie,Traditional Steak and Kidney Pie 🐄😋by Yorkshire Handmade Pies,https://www.youtube.com/watch?v=5O5kfmYjhE0&pp=ygUuaG93IHRvIG1ha2UgdWx0aW1hdGUgbWFrZW92ZXIgc3RlYWsga2lkbmV5IHBpZQ%3D%3D,2.1K views
44,british-pork-cassoulet,Cassoulet — Frenchy meat and bean stew,https://www.youtube.com/watch?v=g_Huy-0Xeek&pp=ygUiaG93IHRvIG1ha2UgYnJpdGlzaCBwb3JrIGNhc3NvdWxldA%3D%3D,634K views
44,british-pork-cassoulet,How To Make a Cassoulet step by step | French Cooking academy visit south of France,https://www.youtube.com/watch?v=nKGsoQM5YJk&pp=ygUiaG93IHRvIG1ha2UgYnJpdGlzaCBwb3JrIGNhc3NvdWxldA%3D%3D,600K views
44,british-pork-cassoulet,How to Make a Real Cassoulet in 3 Acts,https://www.youtube.com/watch?v=yELobwUjkog&pp=ygUiaG93IHRvIG1ha2UgYnJpdGlzaCBwb3JrIGNhc3NvdWxldA%3D%3D,7.7K views
45,no-fuss-shepherds-pie,Paula's Kitchen S2 Ep1: No-Fuss Shepherd's Pie,https://www.youtube.com/watch?v=mg5WsJYJ5Ak&pp=ygUhaG93IHRvIG1ha2Ugbm8gZnVzcyBzaGVwaGVyZHMgcGll,6.2K views
45,no-fuss-shepherds-pie,Shepherd's Pie Recipe | Easy No-Fuss Recipe | Hungry for Goodies,https://www.youtube.com/watch?v=6ulMpdmcH00&pp=ygUhaG93IHRvIG1ha2Ugbm8gZnVzcyBzaGVwaGVyZHMgcGll,4.1K views
45,no-fuss-shepherds-pie,Guaranteed Clean Plates! My Family Favourite Shepherds Pie,https://www.youtube.com/watch?v=4AQ8aGyql48&pp=ygUhaG93IHRvIG1ha2Ugbm8gZnVzcyBzaGVwaGVyZHMgcGll,578K views
46,split-pea-green-pea-smoked-ham-soup,How to Make Easy Split Pea and Ham Soup | Allrecipes,https://www.youtube.com/watch?v=7prConQEbWg&pp=ygUvaG93IHRvIG1ha2Ugc3BsaXQgcGVhIGdyZWVuIHBlYSBzbW9rZWQgaGFtIHNvdXA%3D,209K views
46,split-pea-green-pea-smoked-ham-soup,Split Pea Soup - How To Make Split Pit Pea and Ham Soup,https://www.youtube.com/watch?v=qdhWz7qAaCU&pp=ygUvaG93IHRvIG1ha2Ugc3BsaXQgcGVhIGdyZWVuIHBlYSBzbW9rZWQgaGFtIHNvdXA%3D,642K views
46,split-pea-green-pea-smoked-ham-soup,How to make Split pea Soup - Pea and Ham Soup - Split Pea and ham Soup,https://www.youtube.com/watch?v=doQQSSHNc4w&pp=ygUvaG93IHRvIG1ha2Ugc3BsaXQgcGVhIGdyZWVuIHBlYSBzbW9rZWQgaGFtIHNvdXA%3D,147K views
47,rum-punch,RUM PUNCH | Caribbean Recipes,https://www.youtube.com/watch?v=k7CrqNdF9zs&pp=ygUVaG93IHRvIG1ha2UgcnVtIHB1bmNo,120K views
47,rum-punch,How To Make Jamaican Rum Punch | Rum Punch,https://www.youtube.com/watch?v=IPtb4F0U_Eo&pp=ygUVaG93IHRvIG1ha2UgcnVtIHB1bmNo,37K views
47,rum-punch,FRUITY Caribbean RUM PUNCH recipe! Made EASY!,https://www.youtube.com/watch?v=OBC_knAjPYU&pp=ygUVaG93IHRvIG1ha2UgcnVtIHB1bmNo,180K views
48,jerk-turkey,How to make JERK TURKEY! | (Oven Style) Deddy's Kitchen,https://www.youtube.com/watch?v=5DVKia-SLH8&pp=ygUXaG93IHRvIG1ha2UgamVyayB0dXJrZXk%3D,108K views
48,jerk-turkey,The Must Have Jerk Turkey Recipe,https://www.youtube.com/watch?v=6CX2NFRtJ90&pp=ygUXaG93IHRvIG1ha2UgamVyayB0dXJrZXk%3D,1.8K views
48,jerk-turkey,HOW TO MAKE THE MOST DELICIOUS JERK TURKEY | SO JUICY BAKED TURKEY | CHRISTMAS DINNER,https://www.youtube.com/watch?v=UWhPA4w22EU&pp=ygUXaG93IHRvIG1ha2UgamVyayB0dXJrZXk%3D,8.3K views
